{
  "$schema": "https://json-schema.org/draft/2020-12/schema",
  "$id": "https://harness.tcbs.vn/schemas/test-condition/v1",
  "title": "Test Condition",
  "description": "Một condition = một file tại plans/<plan_id>/conditions/<id>.json. Sharded theo ID để mọi mutation là ghi đè nguyên tử một file nhỏ, không bao giờ patch file lớn.",
  "type": "object",
  "additionalProperties": false,
  "required": [
    "id",
    "plan_id",
    "requirement_id",
    "behavior",
    "behavior_shape",
    "technique",
    "priority",
    "rationale"
  ],
  "properties": {
    "id": {
      "type": "string",
      "pattern": "^TCON-[A-Z]+-\\d{4}$",
      "description": "Phải trùng tên file (không tính .json) — harness kiểm"
    },
    "plan_id": {
      "type": "string",
      "pattern": "^TP-[A-Z]+-\\d{4}$",
      "description": "Phải trùng plan.json của thư mục cha — harness kiểm referential integrity"
    },
    "requirement_id": {
      "type": "string",
      "pattern": "^(REQ-[A-Z]+-\\d{3}|INV-[A-Z]+-\\d+)$",
      "description": "Cites either a REQ- requirement id or an INV-<AREA>-<N> design invariant id (docs/reference/invariant-contract.md) — this harness uses both families for citable requirements, and a test condition traces to whichever one the spec actually produced."
    },
    "behavior": {
      "type": "string",
      "minLength": 10,
      "maxLength": 500,
      "description": "Một câu kiểm chứng được, given/when/then hoặc bất biến"
    },
    "behavior_shape": {
      "enum": [
        "mapping",
        "stateful",
        "computational",
        "decision",
        "parsing",
        "concurrent",
        "integration",
        "fixed_rule"
      ]
    },
    "technique": {
      "enum": [
        "property",
        "decision_table",
        "mcdc",
        "boundary_value",
        "equivalence_partition",
        "state_transition",
        "example",
        "contract",
        "e2e_scenario",
        "jcstress",
        "deterministic_replay",
        "fuzzing"
      ]
    },
    "property_kind": {
      "enum": [
        "invariant",
        "round_trip",
        "model_based",
        "metamorphic",
        "field_sensitivity",
        "algebraic"
      ],
      "description": "Bắt buộc khi technique = property, cấm khi khác"
    },
    "priority": {
      "enum": [
        "P0",
        "P1",
        "P2"
      ]
    },
    "rationale": {
      "type": "string",
      "minLength": 10,
      "maxLength": 500,
      "description": "Vì sao technique này khớp behavior_shape này"
    }
  },
  "if": {
    "properties": {
      "technique": {
        "const": "property"
      }
    }
  },
  "then": {
    "required": [
      "property_kind"
    ]
  },
  "else": {
    "not": {
      "required": [
        "property_kind"
      ]
    }
  }
}